{
  "$schema": "https://json-schema.org/draft/2020-12/schema",
  "$id": "https://maveniverse.eu/schemas/scalpel-report-v2.json",
  "title": "Scalpel Report",
  "description": "JSON report produced by Scalpel (report and trim modes) describing which modules in a Maven multi-module reactor are affected by a git changeset.",
  "type": "object",
  "required": [
    "version",
    "scalpelVersion",
    "baseBranch",
    "fullBuildTriggered",
    "triggerFile",
    "changedFiles",
    "changedProperties",
    "changedManagedDependencies",
    "changedManagedPlugins",
    "excludedUpstreamCount",
    "affectedModules"
  ],
  "properties": {
    "version": {
      "type": "string",
      "const": "2",
      "description": "Report schema version. '2' indicates the v2 format with category, sourceSet, excludedUpstreamCount, testsSkipped, and testsSkippedReason fields, plus the optional fields added within v2 under the compatibility policy: status, reason, unmatchedPomPaths, skippedModules, evidence, timings, and operations."
    },
    "scalpelVersion": {
      "type": "string",
      "description": "The version of the Scalpel extension that produced this report (e.g. '0.3.9')."
    },
    "baseBranch": {
      "type": "string",
      "description": "The base branch that was compared against (e.g. 'origin/main')."
    },
    "decisionId": {
      "type": "string",
      "description": "Optional. A stable SHA-256 identity of the decision: the merge-base and head commits, the resolved decision-shaping configuration, and the resulting build set. Quotable in bug reports to correlate a failure back to the Scalpel decision that produced it."
    },
    "mergeBaseId": {
      "type": "string",
      "description": "Optional. The merge-base commit id the decisionId was computed over."
    },
    "headId": {
      "type": "string",
      "description": "Optional. The head commit id the decisionId was computed over."
    },
    "configFingerprint": {
      "type": "string",
      "description": "Optional. The resolved decision-shaping configuration fingerprint the decisionId was computed over."
    },
    "buildSetSize": {
      "type": "integer",
      "minimum": 0,
      "description": "Optional. Modules in the final build set (affected plus upstream prerequisites). With affectedModules and skippedModules the reactor partition reads directly."
    },
    "reactorModuleCount": {
      "type": "integer",
      "minimum": 0,
      "description": "Optional. Total number of modules in the Maven reactor. Together with buildSetSize lets consumers compute 'built N of M' directly from the report."
    },
    "testedModulesCount": {
      "type": "integer",
      "minimum": 0,
      "description": "Optional. Modules whose tests actually run."
    },
    "fullBuildTriggered": {
      "type": "boolean",
      "description": "True if a changed file matched a fullBuildTriggers pattern, causing a full reactor build."
    },
    "triggerFile": {
      "type": ["string", "null"],
      "description": "The first changed file that matched a fullBuildTriggers pattern, or null if no full build was triggered."
    },
    "changedFiles": {
      "type": "array",
      "items": { "type": "string" },
      "description": "Git-relative paths of all files changed between baseBranch and HEAD."
    },
    "changedProperties": {
      "type": "array",
      "items": { "type": "string" },
      "description": "Names of Maven properties whose values changed in a POM diff."
    },
    "changedManagedDependencies": {
      "type": "array",
      "items": { "type": "string" },
      "description": "Coordinates (groupId:artifactId) of managed dependencies whose version changed in the root POM."
    },
    "changedManagedPlugins": {
      "type": "array",
      "items": { "type": "string" },
      "description": "Coordinates (groupId:artifactId) of managed plugins whose version or configuration changed in the root POM."
    },
    "unmatchedPomPaths": {
      "type": "array",
      "items": { "type": "string" },
      "description": "Optional. Git-relative paths of changed POMs that match no reactor project (profile-gated modules or modules excluded via -pl). Their changes are ignored by Scalpel. Present only when non-empty."
    },
    "excludedUpstreamCount": {
      "type": "integer",
      "minimum": 0,
      "description": "Number of upstream (build-prerequisite) modules excluded from affectedModules. These modules are built because of dependency ordering but are not genuinely affected by the changeset."
    },
    "affectedModules": {
      "type": "array",
      "items": { "$ref": "#/$defs/affectedModule" },
      "description": "Modules affected by the changeset, with reasons and optional metadata."
    },
    "skippedModules": {
      "type": "array",
      "items": { "$ref": "#/$defs/skippedModule" },
      "description": "Optional (added without a version bump per the optional-fields policy): reactor modules left out of the build set, each with the reason it was judged safe to skip. Present only when at least one module was skipped."
    },
    "status": {
      "type": "string",
      "enum": ["failed", "skipped"],
      "description": "Present only on status-only documents written when analysis did not complete: 'failed' for error/failSafe bail-outs, 'skipped' for deliberate non-analysis paths (e.g. no changes detected, disabled by disableOnBranch/disableOnBaseBranch/disableTriggers, or all changed files excluded by path filters)."
    },
    "reason": {
      "type": "string",
      "description": "Human-readable explanation accompanying an optional status field (e.g. 'no changes detected')."
    },
    "timings": {
      "type": "object",
      "description": "Optional (#99): phase timing instrumentation for the analysis run. Present only when at least one phase was recorded; omitted entirely (not null, not empty) from status-only documents and uninstrumented reports.",
      "required": ["totalMillis", "phases"],
      "properties": {
        "totalMillis": {
          "type": "integer",
          "minimum": 0,
          "description": "Wall-clock milliseconds for the whole Scalpel analysis."
        },
        "phases": {
          "type": "object",
          "additionalProperties": {
            "type": "integer",
            "minimum": 0
          },
          "description": "Milliseconds spent per phase (repoOpen, fetch, mergeBase, diff, status, readOldPoms, moduleMapping, pomAnalysis, transitiveResolve, trim, applySkipTests). Only phases that ran are present; phase names may grow additively."
        }
      }
    },
    "operations": {
      "type": "object",
      "description": "Optional (#99): analysis operation counters. Present only when at least one operation was counted; omitted entirely from status-only documents and uninstrumented reports.",
      "properties": {
        "blobs": {
          "type": "integer",
          "minimum": 0,
          "description": "Git blobs read for old-POM comparison."
        },
        "models": {
          "type": "integer",
          "minimum": 0,
          "description": "Effective POM models built (old state plus current state)."
        },
        "resolves": {
          "type": "integer",
          "minimum": 0,
          "description": "Dependency graph resolutions performed."
        },
        "resolveCacheHits": {
          "type": "integer",
          "minimum": 0,
          "description": "Resolutions served from the shared collect cache instead of re-resolved."
        },
        "resources": {
          "type": "integer",
          "minimum": 0,
          "description": "Filesystem entries visited by the filtered-resource scan."
        }
      }
    }
  },
  "$defs": {
    "affectedModule": {
      "type": "object",
      "required": ["groupId", "artifactId", "path", "reasons"],
      "properties": {
        "groupId": {
          "type": "string",
          "description": "Maven groupId of the affected module."
        },
        "artifactId": {
          "type": "string",
          "description": "Maven artifactId of the affected module."
        },
        "path": {
          "type": "string",
          "description": "Reactor-relative path of the module directory."
        },
        "reasons": {
          "type": "array",
          "items": {
            "type": "string",
            "enum": [
              "SOURCE_CHANGE",
              "TEST_CHANGE",
              "POM_CHANGE",
              "TRANSITIVE_DEPENDENCY",
              "TRANSITIVE_DEPENDENCY_TEST",
              "TRANSITIVE_DEPENDENCY_UNRESOLVED",
              "MANAGED_PLUGIN",
              "DOWNSTREAM_DEPENDENT",
              "DOWNSTREAM_TEST",
              "FORCE_BUILD"
            ]
          },
          "minItems": 1,
          "description": "Why this module is included in the affected set."
        },
        "category": {
          "type": "string",
          "enum": ["DIRECT", "UPSTREAM", "DOWNSTREAM", "TRANSITIVE"],
          "description": "How this module relates to the change: directly changed, upstream prerequisite, downstream dependent, or transitively affected via managed dependencies/plugins."
        },
        "sourceSet": {
          "type": "string",
          "enum": ["main", "test"],
          "description": "Which source set triggered the change. Present on directly affected modules with source changes."
        },
        "testsSkipped": {
          "type": "boolean",
          "const": true,
          "description": "Present and true when tests are skipped for this module. The reason is given in testsSkippedReason."
        },
        "testsSkippedReason": {
          "type": "string",
          "description": "Why tests were skipped on this module (e.g. 'EXCLUDED_DOWNSTREAM' for downstream modules not in the test scope)."
        },
        "evidence": {
          "type": "array",
          "items": { "type": "string" },
          "description": "Specific inputs behind this module's decision, emitted only with -Dscalpel.explain=true (e.g. a changed file path, 'property <name>', 'managed dep <groupId:artifactId>', 'managed plugin <groupId:artifactId>', 'downstream of <groupId:artifactId>')."
        }
      }
    },
    "skippedModule": {
      "type": "object",
      "required": ["groupId", "artifactId", "path", "reason"],
      "properties": {
        "groupId": {
          "type": "string",
          "description": "Maven groupId of the skipped module."
        },
        "artifactId": {
          "type": "string",
          "description": "Maven artifactId of the skipped module."
        },
        "path": {
          "type": "string",
          "description": "Reactor-relative path of the module directory."
        },
        "reason": {
          "type": "string",
          "enum": ["NOT_AFFECTED"],
          "description": "Why the module was left out of the build set. NOT_AFFECTED: not affected by the changeset (not direct, transitive, upstream or downstream of any change)."
        }
      }
    }
  }
}
